;tipo;Vraag;Respuesta;Alternativa 1;Alternativa 2;Alternativa 3
129;-;¿Qué alimento tiene más grasa?;Vegetable oil, apricot kernel;Dessert, pudding, vanilla, dry mix, regular, unprepared;Soup, cream, chicken, canned, condensed, 2% M.F. milk added;Pork, shoulder, picnic (arm), lean, roasted
130;-;¿Qué alimento tiene más grasa?;Vegetable oil, avocado;Beverage mix, carob flavour, powder;Arugula, raw;Fish, bass, fresh water, mixed species, baked or broiled
131;-;¿Qué alimento tiene más grasa?;Vegetable oil, babassu;Candies, fondant, homemade;Purslane, raw;Poultry, mechanically deboned, from backs and necks with skin, raw
132;-;¿Qué alimento tiene más grasa?;Vegetable oil, canola;Dessert, pudding, banana, dry mix, regular, unprepared;Soup, chicken gumbo, canned, condensed, water added;Beef, spleen, raw
133;-;¿Qué alimento tiene más grasa?;Vegetable oil, cocoa butter;Dessert, pudding, vanilla, dry mix, instant, unprepared;Tomato, orange, raw;Turkey, all classes, drumstick, meat and skin, raw
134;-;¿Qué alimento tiene más grasa?;Vegetable oil, coconut;Dessert, pudding, banana, dry mix, instant, unprepared;Chrysanthemum leaves, raw;"Beef, flank, flank steak, boneless, lean and fat, 0mm (0"") trim, raw"
135;-;¿Qué alimento tiene más grasa?;Vegetable oil, corn;Candies, nougat, with almonds;Chrysanthemum, garland, raw;Ham, lean, canned
136;-;¿Qué alimento tiene más grasa?;Vegetable oil, corn and canola;Icing (frosting), chocolate, creamy, dry mix, unprepared;Lettuce, cos or romaine;Fish, whitefish, lake, native, baked
137;-;¿Qué alimento tiene más grasa?;Vegetable oil, corn, peanut and olive;Dessert, pudding, lemon, dry mix, regular, unprepared;Spinach, canned, drained solids;"Beef, brisket, lean, 0mm (0"") trim, braised"
138;-;¿Qué alimento tiene más grasa?;Vegetable oil, cottonseed;Dessert, flan, caramel custard, dry mix, unprepared;Fast foods, sandwiches and burgers, cheeseburger, large, triple patty, plain;Chicken, broiler, thigh, meat and skin,  stewed
139;-;¿Qué alimento tiene más grasa?;Vegetable oil, grapeseed;Candies, taffy, homemade;Squash, summer, crookneck, canned, drained solids;Pork, loin, centre cut (centre chop), bone-in, lean and fat, broiled
140;-;¿Qué alimento tiene más grasa?;Vegetable oil, hazelnut;Dessert, rennin, chocolate, dry mix, unprepared;Cabbage, Chinese (pe-tsai), raw;Chicken, broiler, thigh, meat and skin, raw
141;-;¿Qué alimento tiene más grasa?;Vegetable oil, mustard;Drink, fruit flavour, powder, vitamin C, unsweetened;Soup, cream, chicken, canned, condensed, water added;Pork, shoulder, butt (blade boneless), lean, roasted
142;-;¿Qué alimento tiene más grasa?;Vegetable oil, oat;Grains, cornstarch;Vine spinach, raw;Pork, loin, centre cut (centre chop), bone-in, lean, braised
143;-;¿Qué alimento tiene más grasa?;Vegetable oil, olive;Dessert, pudding, rice, dry mix, unprepared;Alcohol, table wine, all (11.5% alcohol by volume);Turkey, all classes, heart, simmered
144;-;¿Qué alimento tiene más grasa?;Vegetable oil, palm;Sweetener, sucralose, SPLENDA;Meat loaf with tomato sauce, mashed potatoes and peas;Fish, whitefish, lake, native, raw
145;-;¿Qué alimento tiene más grasa?;Vegetable oil, palm kernel;Beverage mix, chocolate flavour, powder;Babyfood, dinner, jarred or frozen, chicken with vegetables, all stages;Fish, salmon, coho, wild, poached
146;-;¿Qué alimento tiene más grasa?;Vegetable oil, peanut;Candies, Skittles;Waxgourd (Chinese preserving melon), raw;Turkey, hen, dark meat only, roasted
147;-;¿Qué alimento tiene más grasa?;Vegetable oil, poppyseed;Dessert, gelatin, dry mix, unprepared;Swamp cabbage (skunk cabbage, water convulvolus), raw;Veal, sirloin, lean and fat, raw
